{
  "schema_version": "1.0",
  "module_id": "M1",
  "version": 1,
  "status": "gaps_open",
  "summary": "希望提升目标流程效率，但还没有验证基线。",
  "canvas_fields": {
    "goal": "提升效率"
  },
  "conclusions": [
    {
      "id": "M1-C01",
      "statement": "需要提升目标流程效率。",
      "kind": "recommendation",
      "evidence_refs": ["M1-T01-P004"],
      "confidence": "medium",
      "review_status": "proposed"
    }
  ],
  "gaps": [
    {
      "id": "M1-G01",
      "topic": "缺少现状基线与目标阈值",
      "severity": "blocker",
      "impact": "无法判断方案是否创造价值，也无法设计最小验证。",
      "question": "当前平均处理时间是多少，首轮验证达到多少算通过？",
      "status": "open",
      "resolution": null
    }
  ],
  "inferences": [
    {
      "id": "M1-I01",
      "statement": "处理时间可能是最重要指标。",
      "impact": "core",
      "status": "pending",
      "evidence_refs": []
    }
  ],
  "alignment": {
    "consensus": [],
    "divergences": [],
    "decisions": []
  },
  "approval": {
    "version": null,
    "confirmed_by": [],
    "accepted_gap_ids": [],
    "notes": ""
  },
  "gate": {
    "render_allowed": false,
    "checked_at": null,
    "reasons": []
  }
}
